{
  "contract_name": "governance.export_delete_review",
  "contract_version": "1.0.0",
  "schema_version": "1.0.0",
  "tenant_id": "tenant-lab-001",
  "customer_context_id": "customer-context-main",
  "environment": "dry_run",
  "correlation_id": "corr-export-delete-review-delete-conflict-001",
  "causation_id": "gov-delete-req-001",
  "idempotency_key": "idem-export-delete-review-delete-conflict-001",
  "producer": {
    "component": "security_reviewer",
    "produced_at": "2026-05-24T18:15:00Z"
  },
  "policy_version": "policy-phase0-v1",
  "taxonomy_version": "taxonomy-recon-v1",
  "review_id": "review-export-delete-002",
  "request_type": "delete",
  "requester_ref": "operator:operator-lab-001",
  "reviewer_ref": "security:reviewer-lab-001",
  "target_refs": [
    "delete-scope-customer-exit-001"
  ],
  "data_classes": [
    "customer_confidential",
    "sensitive_legal"
  ],
  "retention_policy_refs": [
    "retention-rule-phase0-evidence"
  ],
  "redaction_profile_ref": null,
  "preservation_hold_status": "conflict_with_delete",
  "export_review_status": "not_requested",
  "delete_review_status": "conflict_detected",
  "conflict_codes": [
    "export_delete_conflict_active",
    "export_delete_preservation_hold_active"
  ],
  "decision": "denied",
  "reason_codes": [
    "export_delete_conflict_active",
    "evidence_ref_missing"
  ],
  "evidence_refs": [
    "ev-delete-conflict-denied-001"
  ],
  "conflict_evidence_refs": [
    "ev-delete-conflict-denied-001"
  ],
  "delete_proof_refs": [],
  "export_manifest_refs": [],
  "created_at": "2026-05-24T18:12:00Z",
  "reviewed_at": "2026-05-24T18:15:00Z",
  "raw_content_included": false,
  "secret_material_included": false
}
